{
  "evidence_id": "ev-3",
  "provider": "quality",
  "provider_version": "1",
  "repository": {
    "canonical_root": "/repo",
    "repository_id": "git:0123456789abcdef0123456789abcdef01234567",
    "worktree_id": "git-worktree:0123456789abcdef0123456789abcdef01234567"
  },
  "subjects": {},
  "content_hashes": {},
  "policy_fingerprint": "policy-1",
  "observed_at": "2026-07-15T00:00:00Z",
  "freshness": {},
  "status": "unavailable",
  "provenance": {
    "references": [
      {
        "node_id": "wv-123abc",
        "commit_sha": "0123456789abcdef0123456789abcdef01234567",
        "semantic_ref": "quality-provider-unavailable"
      }
    ]
  }
}
